,index,story
68,68,"The Story Behind the Story
This story has been swirling around inside of me for the better part of two decades. I remember being in high school, sitting in my bedroom with my best friend, quietly writing in a notebook while he worked on a project of his own. I read the scene I had written aloud to him. He wanted more of the story. I thought about the characters all the time. I drew maps and created the alphabet of a created language. I worked at a grocery store, and on slow nights, I would print out blank sheets of the receipt tape, and scribble down ideas and conversations between characters in between transactions. I still have that old notebook and all those receipt papers. Through my determination not to let it die, and because of the many friends who continued to ask me about the book, I’m here at the threshold of a lifelong goal: to become a published author.
The World Between
Jamir of Lur-lataer, Priest of The Almighty, is living with a curse. He’ll follow wherever his god directs him to go, but how can he trust in a plan that hasn’t been revealed?
Marina, displaced in time, finds herself confronting a truth she never wanted to learn: she isn’t who she thinks she is.
Jakar of House Arcanan jumped through a portal into the unknown after the woman he has always loved. He won’t leave her, because the future depends on them being together.
Velundovil peels back the layers of time to see everything that has been, and everything that will be. She watches, wishing that there had been another way.
The World Between takes place in a fictional world similar to ours. There are kingdoms with wealthy nobles, cities with sea merchants and towns with humble citizens. There are forests, rivers, mountains and plains. Animal and plant life is like what we would find on Earth and species are named accordingly. This world is a place of magic, though there is disagreement about where it comes from and who can use it. One unique difference is that the world has two suns, one large and one small. Though this is a fantasy novel, absent from the world are other humanoid races such as elves, dwarves, halflings etc. Because the people are not of Earth, their cultures and languages do not exactly mirror those we would find in our world. Groups are more egalitarian in general and there are not many differences between gender roles. The world also has its own pantheon of gods and goddess with religious orders for each.
In writing The World Between, I have tried to incorporate many questions about what it means to be human. My hope is that readers will connect with the key questions that the characters ask themselves throughout the novel: Can I trust in something I can’t see? Is there a calling on my life? Can something good come from something terrible?
Stretch Goals
There are couple of stretch goals for the project and I really hope we can meet both of them.
$3500: Second piece of artwork from Steven Wu- Goal Met
$4500: Stamped Gold Foil Letters on Book Cover
About the Author
Sarah Orr Aten is, and always will be, a nerd. She is a lover of medieval history, an avid reader and a woman who will get swept up in a good story. She is a birth doula, a crafter and a gardener. To pay the bills she had found herself in a data science, reporting and analytics, with a mind to move towards process improvement and/or project management. The biggest influences on her creative life have been R.A. Salvatore, Jean M. Auel, Gary Jennings, A.A. Attanasio, Bruce Coville and Susan Cooper. She also believes that one can love both Star Wars and Star Trek without being forced to pick a side. She lives in Louisville KY with her husband Brandon and their three children and two dogs."
69,69,"The People Outdoor Recreation Network is just an idealistic group who though having no actual physical foundation work together to help people get places and simply have a good time. 
With that we want to make a silly naked calendar to help support getting out there, going places and bearing all for the spirit of it. Ultimately it will be a calendar with tasteful naked people in beautiful setting in and around the US and CANADA (basically wherever we end up). 
The funds will go towards: 
Printing the calendars and sending them to pledgers (around $1800.00 of the cost), printing extra pictures for pledgers (around $300.00), and lastly the random other category ($400.00) this includes but is not limited to getting cameras, dealing with kickstarted fees, buying sharpies and paper to write with and on. "
70,70,I WOULD LIKE TO HAVE SOME T-SHIRTS FOR PEOPLE TO WEAR AND LOOK REALLY GOOD AND SEXY BUT MY FRIEND WILL NOT LET ME HAVE ANY MONEY SO I HAVE DECIDED TO TRY AND RAISE SOME HERE BY TAKING PRE ORDERS ALL T-SHIRTS WILL BE HEAVY GILDAN 100 PERCENT COTTON I DO NOT KNOW WHAT THAT MEANS BUT IT SOUNDS IMPRESSIVE I AM OPEN TO SUGGESTIONS ON WHAT COLOUR THE PRINT SHOULD BE MAYBE A NICE SHOCKING PINK I KNOW SOMETHING ELSE THAT INVOLVES PINK AND SHOCKING BUT THIS IS A FAMILY FRIENDLY SITE SO I WILL NOT GO IN TO DETAIL IF YOU KNOW WHAT I AM SAYING ALSO I KNOW I AM A HORSE BUT I PROMISE NOT TO KICK YOU :3 THIS WILL BE A LIMITED RUN OF T-SHIRTS SO MAKE SURE TO PRE ORDER YOURS
71,71,"With the lights down low, Beats and Feet presents Flip The Switch - a raw showcase of multimedia performance and installation by industry professionals in a Los Angeles warehouse.  We will premiere 2 of our own short films, showcase choreography by performers (of whom may be seen in Cirque Du Soleil and So You Think You Can Dance), and feature designs by live artists.  Enjoy the jam band while sipping a glass from the Vino Bar and prepare to interact with the performers and participate in a live photo experience, among other feature presentations.
The event will take place on Saturday October 29, 2011, 9pm-1:30am with entertainment rolling and looping throughout the evening.   Location and Full list of featured artists TBA.
We need your donations or sponsorship for marketing (website, print, program), equipment rental, stage, and lighting props. 
***View our short films from 2010 - Not Cool and Hip Hopera - as well as live performances from past events - XCollabo Finale, Freestyle Session, Latin Tap."
72,72,"A motivational television talk show with a purpose.  There seems to be a movement at awards shows where celebrities tell their life stories very quickly and remind people to never listen to the Naysayers and to never, ever give up on your dreams, my show will tap into this sentiment but much deeper. I will interview successful people from all walks of life to learn how they overcame their individual failures and survived their darkest days and learn the tools they used to hold on and to continue through their struggles until they made it big. All for one reason, so that WE the audience can learn from their life lessons and apply some of them to our own lives, because we all hurt in some way.  No one's life is perfect and in talking with these celebrities, the audience will hear the grit and determination it takes to succeed when everyone around you is telling you that you can't. Some wonderful guests would be Rhonda Britten, Will Smith, Eminem, J.K. Rowling, Mike Tyson, Tony Robbins and so many other survivors.  All successful people have failed many times in their lives just like you and I and we will learn from their own words how they hung on during the lowest points of their careers and lives, what coping strategies they used, what tools and techniques they used to stay positive in the face of great adversity until they finally made it big.  My sincerest hope for this show is that someone who is watching will hear some gem of advice and ask for help and begin to heal whatever it is they are battling, because we all have our daily battles, sometimes we just need to be reminded to hold on and to keep fighting the good fight.  That's what Great Lives with Kevin Bungert will be, a daily reminder to hold on and to keep fighting, no matter what!  Thank You...Kev"
73,73,"Hello! This is Jazmin from Pics n Plans I am the artist behind the name, my partner is Chosani and I don't know what I would do without her running our Instagram/Facebook pages. We started bullet journaling together over a year ago and we have become obsessed.
https://www.instagram.com/picsnplans/
What is Bullet Journaling? Well, it all started for us at least, with a talented author by the name Ryder Caroll. They are super sweet and you can check out their page below for more info.
https://bulletjournal.com/
We love making customized journals, learning new concepts, and most of all we love sharing our love for journaling with the world. We have seen and met so many wonderful people, and have decided we wanted to start sharing some our creative ideas with everyone.
This Kickstarter is our first step into making our dreams a reality. We have worked super hard in between work, Chosani being a supermom, and a unbearable long commute.
We would love to have you join our Bullet Journal family!
This Kickstarter we are launching our first designs, Pudding the Panda! Our goal, have enough to fund 3 Vinyl waterproof stickers 3""x 3"". I have 2 more designs for stretch goals. If we meet all stretch goals we can upgrade to Holographic/Glitter stickers.
I only listed about 4 tiers to keep the prices reasonable. Of course if you offer more not only will you receive my eternal gratitude, but I may send an extra gift your way. 
Keep your money until we get funded. One cool thing about Kickstarter is that you will not be charged unless we hit goal. During the campaign you can increase or decrease your pledge amount. (But pledging to help us hit $500 enables us to aim for more designs)
Shipping will be sent via USPS first class mail.
If you only contribute a $1 you can still walk away with cool coloring pages to put in your journals/books/etc. (Please do not try to resell, as this would make me very sad.)

The sticker designs are below:
 (All images will be high resolution, I am keeping them low resolution with a watermark so peeps don't take them) 
$600 reached-Design 5 unlocks. Updated picture will be uploaded soon...
700 reached-Design 5 unlocks. Updated picture will be uploaded soon...
 If we reach $800 I can make the stickers holographic!!!
Now these stickers are all going to be 3""x 3"", although resizing may happen. (They will be bigger, since I want to keep the resolution looking nice)
Vinyl and waterproof.
Free thank you sticker surprise in each package. 
Digital download of coloring pages to put into your notebooks, gear, etc.
 September- Kickstarter launches
 October- Kickstarter campaign ends (Surveys are sent out)
 November/December- Stickers are produced and checked for quality
 January/February- Stickers are sent out!
This is an estimated timeline, and any issues with quality may cause a delay. I will be posting updates and keeping everyone in the loop for production.  
Now I understand that these are difficult times and everyone works hard for their money. So if you cannot contribute, I would ask that you share our kickstarter on social platforms. Links will be listed below, or you can share this very Kickstarter page. Please feel free to email me with any questions at picsnplans@gmail.com I will try my best to answer all questions in a speedy fashion. 
https://www.teepublic.com/user/tanukikai
https://picsnplans.wixsite.com/journaling
https://instagram.com/picsnplans/
https://www.youtube.com/channel/UCsq5PNaVjatSs00V6QDhFaw?view_as=subscriber
Seriously thank you for viewing, and becoming a part of our lives. Even if you just join our Instagram family or share our page, it means the world to me. I spent so much time fretting over doing a project like this because I am a very pessimistic person. But if I don't take this chance and take a leap now, I may never. Thank you!!!!!!
Some information about my art career, I studied at the Art Institute and I am sad to say I never finished. I would love to complete that chapter someday. Hopefully this leads me in that direction. I have been seriously freelancing since over 10 years ago. I have designed many logos, tattoos, costumes, and much more. I have studied graphic design, typography, psychology, and Animation. I have also had the opportunity to showcase and sell my art at Katsucon, and Awesomecon. I'm always up for trying new things and taking both suggestions, and critiques. Please feel free to reach me at tanukikai@hotmail.com or via our website.  https://picsnplans.wixsite.com/journaling
Thank you once more! "
74,74,"We at SpeakFreak have one simple goal: to bling out everything. We dream of a world where millions of little bits of nerdy art cover every surface. Children will push pins into each others' casts instead of writing on them. License plates will be replaced by pin boards. People will barely even be able to walk under the weight of metal and enamel.
And now, with our first-ever Kickstarter campaign, you can take a step into that world with us. Does your boss force you to wear a monkey suit and stamp out your individuality? Well, there's nothing unprofessional about a lapel pin! Disgusting sweater you have to wear so you're not the one who ruined Christmas? Pop a few pins in and you'll outshine the tree. Hole in your wall from rage or an escape attempt? No judgement here, just cover that bad boy up with a pin board! 
Pins
Each pin is made of hard enamel with gold plating, and comes packaged with a backing card and 8mm black rubber clutch. For each $200 raised, a new design will be unlocked. Each $10 reward tier earns you one pin of your choice from those available. 
Timeline
December 3rd: Campaign Ends
Early December (or when last design unlocks): Pins are ordered
Mid December: Pins arrive with me and are immediately repackaged and sent out
Follow us on Twitter and Instagram @SpeakFreakInc"
75,75,"Creator - Jason Pasierski
The REVAMPS Breakout Shield is a drop-in upgrade for 3D Printers who utilize a Ramps 1.4 controller board. Ramps 1.4 is an electronics hardware package that commands all the components of a 3D Printer. Our Shield interfaces with Ramps 1.4 and consolidates multiple inputs/outputs into fewer, simpler and more efficient wire management. When we first started designing a 3D Printer, we incorporated a viable electronics hardware package (Ramps 1.4) that was already a staple in the 3D Printing community.
Stock Ramps 1.4
The main focus was about creating a better 3D Printer than what was available. The electronics were initially overlooked in how they would merge with our initial prototypes simply because the mechanics were our main focus. Heck, we were just excited about 3D printing and not concerned about all the nuances. As designs evolved with Printing and wanting to create better hardware, we faced obstacles with the common 3D Printing hardware. We would be forced to choose other similar electrical packages or enhance what we had. The challenge with creating this additional  Breakout Shield for the Ramps 1.4 eventually enabled us to close the design process for our 3D Printer and hopefully you'll see what it can do for you!
Stock Ramps 1.4 wiring
The above image represents an attempt at trying to tidy up the wiring that almost seems inevitable when working with the stock Ramps 1.4 controller. All wires have to be traced back to the individual pins on Ramps 1.4 which are easy to bend/break, packed in a confined space and easily miswired when setting up a 3D Printer. Best described in the shop as ""Rat's Nest"". 
With our Shield, you are able to consolidate multiple inputs/outputs into fewer, higher quality cabling, eliminating the bulk of the wiring and transforming a 3D Printer into something more reliable, accessible and packed with possibilities.
REVAMPS Breakout Shield
Visit us at NYC 2015 MAKER FAIRE Sept. 26, 27th"
76,76,"Hi everyone！I‘m Emma！I have great passion about fashion and want to do a social website of OOTD. Now I have started doing photoshoot for OOTD myself and I want to hire more people to join my team to share interesting, cool and fashionable stuff to inspire everyone's outfit ideas!"
77,77,"Three hundred years ago, a Bristol man called Edward Teach was the terror of the Caribbean. Better known as Blackbeard, he was the most notorious and successful pirate of his day. Teach’s criminal career came to a sticky end in 1718, but he was by no means the only Bristol sailor involved in piracy. The city also has a strong link to fictional pirates. Long John Silver from Treasure Island owned a pub in Bristol. In addition, literature’s most famous castaway, Robinson Crusoe, was based on Alexander Selkirk who came to Bristol after his rescue and there met Daniel Defoe. Woodes Rogers, the Bristol-based captain who rescued Selkirk, was a privateer who preyed on Spanish shipping. He later became Governor of the Bahamas and a scourge of pirates.
A few years ago Wizard’s Tower produced Airship Shape and Bristol Fashion, an anthology of steampunk stories set in and around Bristol, and written by local authors. It did very well, so I wanted to do something similar for the local writing community. When I began to think of a follow-up, pirates immediately came to mind. Everyone loves them, and there is a strong Bristol connection.
However, in thinking about the book it became obvious to me that it could not just be about Bristol. Our pirates didn’t ply their trade in the city; they did so far away across the sea. Most famously they did so in the Caribbean. Any book about pirates, therefore, should not just be about Bristol, but about the Caribbean too, and should involve people from the Caribbean.
Fortunately I happen to know quite a few excellent Caribbean writers of speculative fiction. Some of them have kindly agreed to write for this book. I’m hoping to work with them, and with my colleagues at Ujima Radio, to reach out to budding writers from the Caribbean, and to writers of Caribbean descent living in Bristol.
Although we do have some writers already signed up, the book will be open to submissions, assuming we achieve our funding goals.
Given the nature of speculative fiction writers, I am sure that people’s imaginations will rove far and wide. The book will contain stories about pirates, but some of them may ply their trade in the South China Sea, or in deep space, or with the help of a friendly dragon. All that we ask is that the stories should be about piracy, and that either the story or the writer should have some connection to Bristol and/or the Caribbean.
As for you readers, splice the mainbrace! Or have something non-alcoholic if you prefer. Then patch your eye, map your treasure and buckle on your parrot (dead or alive). It is time to take the Seven Seas, no matter where in space and time they might be found.
Cheryl Morgan
Piracity (noun)
1. Piratical behaviour
2. A city of pirates
The Crew
Editorial:
Joanne Hall (editor) lives in Bristol, and with Roz Clarke, she has edited and contributed to Colinthology, Airship Shape and Bristol Fashion and Fight Like A Girl. She has had seven fantasy novels published and is the Chair of Bristolcon. She tweets far too often at @hierath77.
Roz Clarke (editor) resides in a hidden corner of North Bristol, deep in the tall grass. She's a freelance writer and editor, and a graduate of the MMU Creative Writing MA and of Clarion West. She is a guest editor at Kristell Ink, has had short stories published in various magazines and anthologies and is co-editor of the anthologies Colinthology, Airship Shape & Bristol Fashion and Fight Like A Girl, alongside Joanne Hall. She's been a member of the BristolCon committee since its inception in 2009, and is delighted to have come to rest in that peculiar, inspiring city. You can twit her at @zora_db.
Cheryl Morgan (managing editor) is the owner of Wizard's Tower Press. This is her project.
Writers:
Karen Lord (Barbados) Barbadian author, editor and research consultant Karen Lord has been a physics teacher, a diplomat, a part-time soldier, and an academic at various times and in various countries. Her debut novel Redemption in Indigo won the 2008 Frank Collymore Literary Award, the 2010 Carl Brandon Parallax Award, the 2011 William L. Crawford Award, the 2011 Mythopoeic Fantasy Award for Adult Literature and the 2012 Kitschies Golden Tentacle (Best Debut)
Stephanie Saulter (London/Jamaica) is best known as the author of Gemsigns, Binary and Regeneration, which use the lens of an altered humanity to take a new look at the old issues of race, class, inequality and social conflict. Her next book, Sacred, will be less science fictional and quite possibly unclassifiable.
R.S.A. Garcia (Trinidad) is the author of Lex Talionis, published by Dragonwell Publishing in 2014. It received a starred review from Publishers Weekly and the Silver Medal for Best Scifi/Fantasy/Horror Ebook from the Independent Publishers Awards (IPPY 2015).She lives in the Caribbean nation of Trinidad and Tobago with an extended family and far too many dogs.
Gareth L. Powell (Bristol) is the author of the award-winning Ack-Ack Macaque series, and other novels. His next trilogy, Embers Of War, will be published by Titan Books in 2018.
Jonathan L. Howard (Keynsham) lives in a small town near Bristol where there is an actual place called The Fear Institute. He is not afraid of it. Contrary to rumors, he is not a necromancer. He just writes about one. That would be Johannes Cabal, of course. Jonathan is also responsible for Carter & Lovecraft.
For more information about Caribbean science fiction writers, see this splendid resource.
Stretch Goals
We have them. Here's the plan.
At £15,000 we'll add some essays about pirate history.
At £20,000 we'll produce hardcover editions of Piracity (and add extra reward levels so you can order them).
At £25,000 we'll pay our writers, editors and other contributors more."
78,78,"Tomorrow's Doctors are only going to be as good as how well educated they are today. 
In Medical school we are mainly left to fend for our self. We have books thrown at us with the expectation of knowing them inside out, without any real walk-through or explanation. Leaving most students to struggle, mundanely memorize and never really understand the actual medical importance of the practices that could save someones life. 
Yes is the answer to your question if you are asking yourself right now 'Is this happening to the doctor that might be trying to save my life one day'. 
I hope to create an online user interface where students in later years of education can provide help and tuition to their fellow medics in the years below. This will allow them a service where they can selectively choose how and by who they want to be educated by, giving them the freedom of being able to learn in the way they can best.  
In medicine experience is key, giving people the opportunity to be taught by someone who has went through the same hurdle not long ago is the most effective way to mold brilliant Doctors who can go on the use that knowledge to help and save people. 
For this project to become possible: I will need capital to set up the website and maintain it as well as to market the idea and increase the awareness of it amoung the student community. 
A crowd funding website is last place I expected myself to be But I know I can not do this alone. This is not just important for me or future Doctors, it is important for everyone because the education we invest in today will be the result we receive tomorrow. 

I believe this will make a difference. It will allow doctors to study with passion and not just pressure and who knows it might even save someones life; YOU might even save someones life.
I urge everyone to PLEASE help me make this dream possible. For a better future, for all of us. 
Thank you."
