,index,story
30,30,"Welcome and thank you for visiting my very first Kickstarter - the Haikyuu Space Kids Pins Series! I'm Jeanine (aka Jeanini/Nini), a WOC freelance artist based in Texas. If this is your first time seeing my work, I'm also on Twitter, Instagram, and Tumblr - and also run a small shop! I love drawing fanart and designing merch; my style leans more towards cute and colorful. 
This series of pins stemmed from the pin I designed for the Sunshine: Hinata Zine! After falling in love with it, I decided to expand the theme to the other Karasuno 1st years. I hope you love these pins as much as I do!
This Kickstarter will start with 2 designs for backers to choose from, with 3 more designs to unlock. There is also a sticker set that will be offered for those who like the designs but don't want them as pins, and also as an add-on.
$1200 - Hinata Sunshine Pin (2"" hard enamel pin, shiny gold finish, two rubber clutches), Tsukishima Moonlight Pin (2"" hard enamel pin, slick black nickel finish, two rubber clutches), Sticker Set (5 vinyl stickers, approx. 3""x3)
$1600 - Kageyama Meteor Pin (2"" hard enamel pin, slick black nickel finish, two rubber clutches)
$2000 - Yamaguchi Starry Pin (2"" hard enamel pin, shiny gold finish, two rubber clutches)
$2400 - Yachi Cloudy Pin (1.75"" hard enamel pin, shiny gold finish, two rubber clutches)
 *Update (8/25): All pin tiers will include these stickers (individual die cut) as freebies!
While this may be my first Kickstarter, I have been doing research on other enamel pin Kickstarters and will be following the same process. So here we go!
1. You pledge! Pick a reward and save your payment information. You will not be charged until after the campaign ends, and only if the first funding goal is complete. You can cancel or change your pledge at any time during the campaign!
2. Campaign ends, surveys out! When the campaign ends, I will send out surveys to all backers about which pin design(s) you would like for your reward. You will also submit your shipping information, and only then will you be charged.
3. Production begins! Funds will take a little bit to transfer to my account, and then orders will be placed for the pins and other shipping materials. Once everything is in my possession, I will pack up rewards and ship them out! It'll be a bit of waiting, but I promise you it'll be worth it!
Aug 15th - Sep 5th: Campaign runs
Sep 5th - 19th: Campaign ends, surveys go out, KS funds come in
Mid-Oct: Pins, stickers, and shipping supplies arrive; Inspection, sorting, and packaging begin
Late-Oct/Early-Nov: Rewards begin shipping
Approximately 50% of funding goes towards production of pins and stickers
Approximately 25% of funding goes towards shipping fees and supplies,
Approximately 25% of funding covers Kickstarter fees and taxes
Pictured above is a picture of the Hinata pin I designed for the zine! I've been running my own merch store for years now, and have experience in design and production, and shipping orders to customers."
31,31,"The album EDWARD is in the process of recording, but when the tracking is completed, it must be MIXED, MASTERED, and DUPLICATED for distribution.  This kick starter will fund the first run of CD's and digital distribution, with more in the future.  All recording and production deadlines are in place.  Tracking of the final drum takes begins June 1st.  Guitars, Bass, and vocal finals will be completed by June 16th.  All printing material as well as mixing and mastering will be complete by June 31st.  
This album is a labor of love.  Your contribution will help make it a reality!"
32,32,"Inspired by flower languages and the meanings behind gifting flowers, I have created a series of 9 Eeveelution Pins; each carefully paired with each other, to deliver a meaningful message for yourself or a loved one. 

✤All pins would come with its own backing card. 
✤All shipping are registered  and comes with a tracking code.

UPDATE:

I have the add-on option enabled! After selecting the tier you want, just follow the instructions to add as many pins as you like to your pledge :)
 Edit: Glittery flowers will now have shiny coloration!
Edit 2: Pouch designs are confirmed! You will be able to choose a color in the final survey.
 ✤ All stretch goals unlocked! They will be available as options in the survey.
 ✤ You may pledge an extra 23.5USD(pair) or 12USD(single) to your tier and let me know when the surveys are sent out to get them :)
✤ Timeline is subjected to change depending on when the goal is reached.  

✤ Delivery duration depends on the postal service. I use Singpost which passes mail to your local service once it touches down.

✤ Delivery WOULD probably be adversely affected by covid, as with everywhere else :(

✤ As of now, shipping to SERBIA has been suspended for a while,  and I'm not sure when it will resume. If you are from Serbia please take note! I will update this section if there are any changes.

✤Some photo updates!
✤All main eevee design colors have been filled, awaiting screenprinting and lineart filling~
✤Testing of glitter effect on the flowers

✤ 70% - Production fees
✤ 20%- Shipping and handling fees
✤ 10%- Kickstarter and other fees

I'm Yuu from Tea & Buns and I'm a 3D Artist based in Singapore. Thank you for checking out my first ever kickstarter! I have been actively participating in local conventions since 2012. You can check out my Etsy,  Instagram , and Facebook.
Here is a sample of my other products, you can see more on my etsy!
Thank you for your time and kind support!"
33,33,"Enter the Drudges; the industrial nightmare...
Corruption runs deep throughout all establishments in the Rifedomes of Kaggrimach II. Judges, scabs, litigators, law enforcement, and corporations all prey on the hard work and back-breaking labor of those in the Drudges.
Jasper Rouke, a young man who had the misfortune of being born a Drudger, sees a way to climb out of the lower-class.
Unknowingly, arising out of the Drudges comes at the most precious of costs, the cost of a friend’s life.
Now Jasper finds himself on the wrong side of an inequitable legal system with blood on his hands and remorse in his thoughts.
Inspiration through art
When the owners of Fire Lizard Games read the first edition eBook of Examination, they knew they'd love to incorporate the story into one of their games. After broaching the subject of using it as the thematic setting for the Adventure Module in BASE: a CaRdPG Perry Hartree was excited by the prospect and granted the rights to Fire Lizard Games.
Check out BASE: a CaRdPG here!
Re-imagining
After Perry Hartree granted the rights to Fire Lizard Games for use in BASE: a CaRdPG, Perry wanted to know more about how they developed and formatted (particularly for books in print). Throughout a handful of conversations, Fire Lizard Games agreed to assist Perry in getting greater exposure for Examination (via this Kickstarter, connections, editing, etc.). During this process, it allowed Perry to include some details that were not in the original eBook, as well.
Make 100
The 100 limited hardbound editions of Examination are in the $4 and $14 tiers. The $14 tier includes BASE: a CaRdPG at a discount."
34,34,"Despite the economic, political, cultural and psychological changes the world have undergone over the past decade, the Nigerian education system is still based on the National Policy on Education (NPE) introduced in 1977. This is a great shame for the country as a whole and an act of structural violence on the part of the government and every capable human being (not just Nigerians) who is able to act against such violence. Proper education is a God given right that every human being independent of race, nationality, gender, and socio-economic class should be afforded. As for Nigerians in particular, who fall victim to this outdated educational structure, they often lack the core and personal skill sets needed to affect the Nigerian society in a meaningful way as well as contribute to the world at large. As a result of this, high unemployment rates among past and recent graduates remain a major issue in the country. What is even more striking is that high unemployment covaries with almost every major issue facing the country today – rise of extremist groups (Boko Haram), youth violence, lack of infrastructure, lack of professional training, corruption, mental illness, corrupted legal system and so forth.
 To make matters worse, those who are unable to participate in the educational system fall into illiteracy as business minded and limited centers for knowledge – libraries, community centers and religious centers - lack the most basic resources in which self-education can be achieved. According to a survey conducted by the Federal Government of Nigeria and UNICEF the average rate of literacy for women in Nigeria is at an all-time low of 27% and for men 51%.
 In order to move the educational landscape of Nigeria in the right direction, independent of the government of Nigeria, O.B.A. Public Library of Nigeria’s objective is to provide a free, world-class, public library which will be a center for curating and disseminating knowledge in Nigeria’s most poverty stricken areas. This project will begin in Lagos, Nigeria and later spread to the entire country. Besides providing basic services available in almost any library in countries around the world, such as the issuing of free library membership, the borrowing and returning of children’s and academic books, journal articles, audio books, films & documentaries, access to computers for research and educational purposes, there will also be monthly lectures within different areas of academic disciplines from world class experts around the world, professional and technical workshops in which library members will be able to learn how to write a CV, business plans, use various technical softwares, data analysis, and so forth. Cultural exhibition and performances will also be available in the exhibition center of the library. Finally there will also be a research center affiliated with the library whose library members will be able to apply to be a part of the research group."
35,35,"Photography can be a catalyst for change. It was for 19 young Rwandan orphans and will be again through these dynamic photo workshops.
Help fund photo workshops for the next generation of Camera Kids. 
Founded in 2000, Through the Eyes of Children (TTEC) taught photography to a group of 19 children orphaned by the Rwandan Genocide Against the Tutsi who lived at the Imbabazi Orphanage in Mutura, Rwanda. The workshops were held over 11 years and the resulting photographs were exhibited throughout the world, including at the United Nations and at the premiere of the movie Hotel Rwanda. Funds raised through the children’s photography helped to pay their school fees and proved to them that people value their perspective and want to see Rwanda through their eyes. 
Today, these children, now adults, are extending the project’s mission. The photographers, or “Camera Kids” as they were called, are paying it forward, teaching photography to other vulnerable children around the world. 
This Kickstarter campaign is being launched to raise funds for photo workshops with other vulnerable children from around the world. The photo workshops will be led by three of the original Camera Kids, Mussa Uwitonze, Gadi Habumugisha and Jean Bizimana.These workshops will be captured in a documentary film by the award-winning director, Beth Murphy, and GroundTruth Films. 
Two photo workshops have already been held in the United States: working with Haitian Immigrant teenagers in New Jersey and with foster children in Boston. More workshops are planned for 2019 around the world.
Campaign
Photography has played a role in the life, education and careers of these Rwandan orphans, creating a pathway to memories and community after all was lost in the genocide. Gadi, Mussa and Bizimana believe that they can create the same impact on the lives of other children.
In 2011, the original Camera Kids started a “pay it forward” program by teaching photography to other Rwandan children. In July 2018, Gadi, Mussa and Bizimana expanded the program and led workshops with Haitian Immigrant teenagers and American Foster Children. 
Through this Kickstarter campaign, we plan to conduct additional photo workshops with other vulnerable children throughout the world. Each workshop will be 4-7 days in length and will be both immersive and fun for a group of 20 children at a time. Partnerships with organizations working with vulnerable children in each location have already been established, including Worldwide Orphans who serves thousands of children around the globe and The Home for Little Wanderers in the United States.
Select photos from each workshop will be shared on the Camera Kids Instagram account to showcase the work of the children and their photos will be curated for inclusion in photo exhibitions with each partner organization.
This Kickstarter campaign is to fund Camera Kids’ photo workshops and document the process for a feature documentary film by the GroundTruth Project.
Your contribution today will cover the costs of travel, materials and salaries for Gadi, Mussa and Bizimana. 
 PROJECT HISTORY 
Through the Eyes of Children (TTEC) was conceived by photographer David Jiranek (1958 –2003) in the year 2000 in collaboration with The Imbabazi Orphanage. The Orphanage was established in the aftermath of the 1994 Rwandan Genocide Against the Tutsi by American Roz Carr, who was 82 years old when she dedicated herself to care for hundreds of orphaned children. David began the TTEC photo project at Imbabazi with annual four-week photographic workshops centered on the importance of the children’s perspective and experience. Nineteen children, ranging in ages from eight to 18, were given disposable cameras and taught the fundamentals of photography as they documented themselves and their community. Initially, their photos were developed locally in Rwanda and displayed on the orphanage walls. Since then, the same children have participated in annual workshops from 2000 – 2011. Their photographic body of work documents their lives in Rwanda as the country was rebuilding.
In the Spring of 2001, after David completed his first workshop, he invited photographer Kristen Ashburn, PR professional Jenifer Howard and brand strategist Joanne McKinney to help. When David tragically died in 2003, the project continued on through their volunteer efforts. Today, three of the original camera kids, Mussa Uwitonze, Gadi Habumugisha and Jean Bizimana, stepped up to lead TTEC for the future.
The children’s work has been widely recognized and has been exhibited around the world in such prestigious venues as the United Nations in New York, the Human Rights Watch International Film Festival, The Holocaust Museums of Houston, Texas, and Naples, Florida and at several universities throughout the U.S. and in Europe. Over the course of 15+ years and through the sale of the children’s photography, significant funds were raised to fund the secondary school education for all of the children at the orphanage.  
Check out the work of the original Rwandan camera kids here: 
Today, the Camera Kids are adults, living and working in Rwanda - a number in the field of photography. As this project comes full circle, Gadi, Mussa and Bizimana, once child photographers and Camera Kids themselves, are bringing their work, their lives, their achievements and their hope for tomorrow directly to the next generation of Camera Kids.  They are a true success story of how love, education -- and photography -- can transform lives.
For a historical perspective on the photo workshops, watch this video:
 Why This, Why Now? 
What started as a project to bring happiness into the lives of orphans has morphed into a powerful, life-changing means of work, income and artistic expression. A number of the original Camera Kids have gone on to embrace photography in their careers. Some work as photojournalists for organizations such as Reuters, staff photographers for Starwood Hotels and others work as photo tourism guides, wedding photographers and studio photographers. It is a natural progression of the Project to pay it forward and help other vulnerable youth throughout the world realize the power  of sharing their story through the lens and eyes of children. The resulting documentary film will be a powerful message of hope and transformation that the world should see.
Why Kickstarter?
As a very small, all-volunteer organization, Through the Eyes of Children has dedicated itself to teaching photography to other vulnerable children throughout the world. When this project started, no one thought that photography would change lives -- but it did. Now that the Camera Kids are grown up and ready to take this social impact project to a broader, global scale, they need your help! Your donation will help to cover the necessary funds to run the photo workshops and then to help fund the documentary that will follow their progress. 
Every dollar you donate to this Kickstarter campaign will go directly to support the photo workshops. 
To learn more about Through the Eyes of Children and its ""Camera Kids,"" visit: camerakids.photos 
Kickstarter and You
Funding this Kickstarter Campaign helps us reach a broader audience; an audience that is passionate about helping children, serving the arts and lifting those in need. 
Rewards
All photo printing provided by our friends at Social Print Studio.
$25 Postcard Signed by Camera Kids
$50 8x12 inch Archival Print
$100 8x10 inch Soft Cover Book
$150 12x18 inch Archival Print
$200 16x24 inch Archival Print
$250 Ready-to-Hang 8x12 inch Metal Print
$300 Three 12x18 inch Archival Prints
$500 Ready-to-Hang 16x24 inch Metal Print
$1,000 Ready-to-Hang 24x36 inch Metal Print"
36,36,"-stop the overfishing
-solve the hunger crisis
-reduce trash
-save environment
Just imagine to get rid of all four problems just with one idea. That´s what this project is about.
to produce just 1 kilogram of meat, you need 6 kilograms of corn, 6 kilograms of grass and lots of protein. And of course not to forget you need about 6000 liters of water! Considering the high amount of meat that is produced, it is an unbelievable number of resources we need for the protein. Adding another fact might make you rethink the way you consume protein: About 50% of the fish we catch isn’t used for human consumption but for feeding our kettle for example. It´s simply inefficient. Environmentally and social.
There are huge problems because of trash in Africa. Not just Africa. Around the whole globe there is a massive trash issue. In Kamerun, were i come from , where I grew up, there is just a single waste disposal company. Consequently the people just throw their waste on the streets, which causes a massive trash crisis.
We want to solve exactly these problems with growing and selling the larvae of the black soldier fly as alternative to use these as animal feed, because it´s rich on protein, thus we don´t have to overfish our seas and reduce the trash as well.
With the money I get from you guys, I want to buy a biochemical reactor by the Hermetia company to produce the larvae.
Thank you very much for helping to save the planet we live on and to start a revolution on the way we consume our Proteins"
