,index,story
0,0,"Producto Final
Hi! The funds we will used to pay a pair of prototypes to the start of production. We want is that the device reaches places with more water problems in the world, and is used by people who need it most.
Studies by Nestle indicate that will be generation that ends with water, don't let that!!!
NO WATER, NO FUTURE!!! Think about it! 
NO MORE LIFE, NO MORE ANYTHING IN THE WORLD!!!
Thanks for your cooperation!!
THE WORLD THANKS YOU!!
Hola! los fondos que se recauden se utilizaran para fabricar un par de prototipos, estos dispositivos serán evaluados por la empresa que hará la fabricación, necesitamos de su valioso apoyo para lograr hacer el producto final y lograr nuestra meta, el ahorro de agua y una diferencia Positiva. Confiamos  en poder llegar a los lugares con más problemas de agua en el mundo y a la gente que más lo necesite y así se pueda ahorrar agua y destinarla a un consumo más productivo, que solo eliminar los desechos líquidos, ya que por su naturaleza pueden ser eliminados sin necesidad de gastar agua. Estamos seguros que con ustedes y su apoyo lo lograremos. Los estudios hechos por Nestlé (la compañía más grande del sector alimentos en el mundo) indican que ..""nuestra generación sera la que acabe con el agua...!!!! no lo permitamos, ellos hacen sus cálculos y estimaciones que indican que para el 2050 habra una crisis y guerras por el recurso hídrico, y en 2025 solo una tercera parte tendrá acceso a ella, hagamos algo ahora que estamos a tiempo.
 ¡¡¡SIN AGUA NO TENDREMOS FUTURO!!!
¡¡¡TENEMOS POCO TIEMPO PARA LOGRARLO... VAMOS!!! HAZ LA DIFERENCIA Y HAZ TU FONDEO CON NOSOTROS, 
¡¡¡GRACIAS POR TU APORTACIÓN!!!"
1,1,"At Ormiston Primary School we are looking at creating a community garden to bring the local community into our school to share in the learning. Our aim is to provide a safe environment where students and families can learn about growing, waste management and healthy eating. This will help create a happy healthy life. 
Our garden will be used for class and school growing. Provide lessons on growing, composting and soil management. We will provide plots for families to work in and hopefully run workshops for school and community. "
2,2,"Hello world :-] My name is Bryan. I have been tinkering with metal and stone for about 10 years. I started out wrapping stones in twisted wires for people that I liked. people would occasionally offer to buy my work, but I've never been much of a salesman. over the years I have learned to solder, set stones, craft rivets, and all manner of other techniques. I have invested in what tools I have been able to along the way, but as my skills have broadened, so has my need for the larger, and more expensive tool-sets (Centrifugal casting machine, wet grinder, drill press, bench roller...) well, the list is honestly endless. And the cost of nice stones, and metal media is rather astronomical! What I am asking for is a boost to fund my art. I give half my pieces away to people who are nice, or as gifts. and the other half I either sell cheap, or sit around like hidden treasures :-] I'm not out to necessarily get rich, so much as to enrich the world with off the wall awesome metal things :-] "
3,3,"I'm tired of woman being overlooked and considered ""over the hill' if their age is over a certain number. Let's be out and be proud of our beauty, whatever age we are. If Hollywood can say a men in his 50's can be a leading man and ""most eligible bachelor"", then a ""knockout"" woman over fifty should have her day. I propose a one woman photographic show of our ""American"" beauties called, ""Beauty at ANY AGE."" Come be a part of the movement. Let your inner and outer beauty shine."
4,4,"Table of Contents
• TAPEWORM by Martin Rose
 • OLD HAUNTS by Nathan Robinson
 • “I’LL BE WATCHING” by William F. Nolan
 • NAILS IN YOUR COFFIN by Rachel Coles
 • PETE’S BIG BREAK by Joe McKinney
 • THEM by James Marlow
 • STASH HOUSE by Shaun Meeks
 • THE SAMPLE by Ray Garton
 • HARD RAIN by Bruce Memblatt
 • SQUATTERS by Elizabeth Massie
 • I STILL LIVE by Wayne C. Rogers
 • CENTER STAGE SIDESHOW by Christian A. Larsen
 • STALKER by Tim Jeffreys
 • FOR SHE IS FEARFULLY AND WONDERFULLY MADE by Tim Waggoner
 • RAMPART by Amy Grech
 • SOMNIPHOBIA by P.D. Cacek
 • FUNERAL MEATS by Kristen Houghton
 • TRANSPOSITION by Jason V. Brock
 • THE LAST BOTTLE by Dean H. Wild
 • THE WOODS by Nicholas Paschall
 • THE HOTEL SAN DIGOT by Joseph Rubas
 • DADDY’S GIRL by Lisa Morton
 • BLURRED by Matthew Nichols
 • THE HOUSE by Jonathan Chapman
 • THE NEST by Cory Cone
 • REFLECTOR EYES by Garrett Rowlan
 • WHAT HAPPENED IN VEGAS… by Rena Mason
• PRIVATE FRANKS by Gary Robbe
 • ONE LAST TWEET by Eric J. Guignard
 • BECAUSE WHAT IS MINE IS MINE by Tom Piccirilli
 • CHICKEN by Geoff Nelder

PLUS a FOREWORD from horror legend Bentley Little and an INTRODUCTION from Living Dead co-creator John Russo! 
Regardless of the success of this Kickstarter campaign, SHRIEKS AND SHIVERS FROM THE HORROR ZINE will be released in trade paperback and eBook format on January 6, 2015. 
So, then why are we asking for money? We want to move this project beyond the ""normal"" small press anthology. The majority of funds from this campaign will be funneled back to the emerging authors included in the project. What's an emerging author? They're the authors you may not have heard of yet, but we suspect you will hear of them in the not so distant future. 
The goal here is small, only $2500, much smaller than most anthologies on Kickstarter. The reason behind this is to set obtainable stretch goals. For every $500 over the $2,500 goal, the emerging authors will each receive an additional payment for their stories. This means the sky's the limit!

How will the money be spent? 
This pie chart is based on an estimate of rewards, but it shows how the majority of the funds raised will go back to the authors. 
Special to this campaign is a LIMITED EDITION hardback version of SHRIEKS AND SHIVERS FROM THE HORROR ZINE.  Yes, you read that right, a HARDBACK! "
5,5,"No Man's Land Theatre Company is proud to present its inaugural production of Othello featuring an all female-identified cast and creative team! Our company strives to create brave and safe spaces for female-identified, non-binary, and genderqueer artists. 
We are currently seeking a space in which to produce Othello, and we want to accommodate as many audience members we can get. Unfortunately, New York City theatre spaces are expensive. All donations received will go straight to this production and the funding of a theatrical venue. By donating, you are helping to create a more diverse and inclusive future for New York City theatre.
Thank you for your donations and support of No Man's Land Theatre Company and our production of Othello. 
Follow No Man's Land Theatre Co to get updates on Othello and projects! 
Instagram: @nomanslandtheatreco
Facebook: www.facebook.com/nomanslandtheatreco"
6,6," ***Note: If you're adding physical goods to the digital tier, please add an additional $6 for shipping if you live in the US or $15 if you live internationally. All add-ons can be added to any tier. (For example, I buy the Physical Trio and want one charm, I pledge $60 plus shipping.)
* Also the digital tier should say 2020 not 2019, as per the date listed in the section you're reading right now vs the side box.
Click here or on the image above to go to the demo’s itch link! 
Available on itchi.io for Windows, Mac, and Linux 
Follow us on Twitter for any updates!
EXTREME SPOILER WARNING: This game is about vampires. Demo includes drinking, innuendo, blood and violence (vampire bite), discussion of non-consent relating to vampire bite, occasional situations where protagonist is distinctly and rightfully uncomfortable, but also a consensual bite too.
Our key image/CGs and character art is drawn by the lovely vacuum, who graciously offered to come on board with the project once she saw the script and premise.
Our key image.
We’ve employed two different background artists.
Mochipanko is an interior architecture student and freelance illustrator who wants to share appreciation for her passions with her art - like nature, plants and botanics, but also fashion and atmospheric sceneries and interiors that evoke calm feelings in others. Her dream is to own an independent little plant and art store one day! 
We also try to animate the BGs when we can.
Vivian is a comics artist, background painter, and plant parent working in Toronto. They are also secretly 8 plants in a trench coat and would die without regular sunlight.
Kira created our logo and KS assets!
Potouto created our GUI, and has done other gorgeous UIs for other visual novels. He would be sleeping right now, but Capitalism and Anger keeps hibernation at bay.
Bella helped create the add-on charms you'll find below, and is also drawing the album cover for the OST!
 Our music is done by two wonderful composers.
Pedro Silva has made music under the name Slime Girls for the past 6 years, while also contributing music for upcoming games such as Ooblets, Guildlings and OMORI. You can find them on Bandcamp and Twitter.
Iwakura Komaki is a Japanese composer known for their doujin works as pertaining to the Touhou series, under the circle flap+frog. Their specialty is easy listening and jazz. You can find them on twitter!
You can find samples of the soundtrack here:
There’s a plethora of wonderful writers on board with the project, and while they’re usually assigned to one route due to daytime workload, their flexibility and our style bible allow us to cover our bases if someone gets sick, ensuring we have a better chance of sticking to our schedule.
Chris’ Twitter - Lilly's Twitter - Margot’s Twitter
Jaime’s Twitter - Washi’s Twitter - Deirdre's Twitter
Our editor is Revenant.
Studio Chiffon was founded with one goal in mind: to explore the potential in the concept of vampires (and also maybe to kiss them.) We are now a collective of talent from all over the world, with a diverse staff with varying backgrounds and identities that are all invested in the characters and the stories pertaining to them. Softly, With Teeth is the studio’s first project. We have more than the two members listed below, but we’ve already credited them above!
Olivine Arc is the creative director and head of Studio Chiffon. An artist and a writer rolled into one, she’s had previous experience creating merchandise, successfully running kickstarters, and working on the script side of things. She has fun with all sorts of supernatural creatures, and would like to be able to afford to make more works featuring them in the future. You can find her over on Twitter.
Realga is a woman from Software Deadzone, California, who takes pride in creating efficient solutions in her programming and tackling whatever issues the team may give her. If you enjoy dungeon crawlers, in-depth game walkthroughs with easy accessibility, or trans women enjoying a wholesome romance as they slice up monsters and save the world, consider her Etrian Odyssey Let’s Plays."
7,7,"When it comes to buying course material, students have two essential problems: 
Complexity and Price.  
The world has long understood the price problem, but the complexity problem is less understood, and it directly affects the price problem.  You see, if students don't know all their options, or don't understand what they actually need (or don't need), they're going to pay too much.
PageLess solves the complexity problem, which solves the price problem.
When a student uses PageLess to search for course material, PageLess doesn't focus on the item they searched. It focuses on the CONTENT they need.  This may sound like a minor difference, but there's nothing minor about the savings it creates.
 PageLess isn't a textbook comparison site.  
Yeah, we compare prices as well as anyone, but it's the most boring thing we do. PageLess is a textbook search engine that guides students through the buying process so they only buy what they need.  Other search engines return results for a single item.  PageLess returns results for EVERY item with the same content.
And PageLess doesn't sell anything.  After we work our fancy textbook magic and give students all their options, PageLess sends them to the websites they already know and trust to complete their purchases.  Incidentally, PageLess makes a small commission when students use our links, which will allow us to make PageLess sustainable. 
Our website is programmed in Angular, a state-of-the-art programming language that creates a wildly pleasing user experience. Our design and branding is as futuristic as the service we offer.  We have a world class software developer on staff and are contracting with other professionals to help us program, design, and market PageLess once it's completed.
""Ok, great.  But how does it work?""
So glad you asked.
We tried to make PageLess intuitive and self-explanatory when using it, but since you are reading a Kickstarter and not using our site, let's break it down.
In the screenshot below, the student searched for a looseleaf book (a book with no binding.)  They probably thought the looseleaf was going to be cheaper.  It isn't. PageLess connected the looseleaf ISBN they searched to every format available. It's going to save this student a lot of money.  It’s also going to get them a nicer book for class.
The higher quality bound version of the book is about half price. Rent it instantly in the digital format if you need it fast.
Other comparison sites would have only compared the price of the looseleaf book and maybe the eBook.  With PageLess, we compare 6 options, and some are much cheaper. 
But here's PageLess' most powerful capability.
In the example below,  PageLess does what no other textbook search engine can fully do. It identifies the FORMAT of every searched item and links it together with every other format that has the same content!  In our example, PageLess instantly knows that the item searched is a textbook package, specifically an access code package that consists of two items: a printed book and a one-time use printed access code.  
PageLess knows that the item searched comes with an access code.
Let's say the student clicks ""yes"" because they need the access code.  They will then see this:
PageLess knows what content is contained in every search.
And here's the results page.  Note: the student has the option to add a print book if they wish, or to just buy the package they originally searched, but we don't suggest doing that, as it's going to cost him or her a lot more money.  Before PageLess, this student had a single option--to purchase the full package for over $100.
PageLess knows the access code already comes with an eBook, so save money and just buy the code.
But what if you don't need that access code? It's fairly common to not need it. Choose ""No, I don't need the code"" and you will see this:
Don't need the code, then don't buy on the package page!
PageLess directs those students who don't need the code to just buy the book (which is a different format), and then offers them that book's CONTENT in every format available. Check it out:
If you don't need the code, just buy the book, but NOT on the package page.
PageLess does so much more than these two examples.  I could go on...but you may have noticed that we're already going a bit long here.
So, why do we need your money?
Students need your help, especially during this pandemic, to find the content they need at the lowest price possible, and they have to be able to do it remotely.
We'll use the money we raise to complete the technical work on our site, which is mainly research and development, working out bugs, testing, and data entry. PageLess' complexity is mind-boggling, and our developers informed us that they only work if we pay them.  
 If we exceed our goal, we'll use the money to save students even more.
Every cent earned over $4500.00 will go toward helping students save money.  We have lots of ideas for new functionality and for integrating formats that publishers are just creating.
Check out our rewards.  
A  Zoom session or presentation will make you a PageLess expert.  Once you're an expert you can spread the word and teach your friends or colleagues.  You'll pretty much be a hero.
Oh, and consider grabbing one of our environmentally friendly and beautifully branded aluminum or stainless steel water bottles. 
24 oz single wall aluminum water bottle Includes carabiner and key ring Height: 9-7/8"" Width: 2-3/4""
17 oz BPA Free Double wall 18/8 stainless steel thermal bottle Copper vacuum insulation Threaded stainless steel lid Keeps drinks (Hot 12 hours) and (cold 24 hours) Dimensions: 10-3/8"" H x 3"" W
Students need PageLess NOW.
PageLess was always going to help students, but there has never been a better time for it to launch than now.  Because of the pandemic, millions of students find themselves going to school online for the first time.  They have no bookstores.  They have no on-campus help to find their course material.  With your help, PageLess can stand in the gap and help students source the CONTENT they need for less. 
Make a pledge.  Share this campaign with anyone you know who is a student or who has students in their lives.  Post it on social media.  Together we can help make college affordable for all."
